{
  "run_id": "run_01KDVDNAZ83BAMMYCEGWF33DPM",
  "model_version": "mv_01KDVDNAZ83BAMMYCEGWF33DPM",
  "configuration_id": "cfg_9eda1821d7a3f8b5c965f4375058e544a3aba022644d6a94d9e446a63100a5f0",
  "input_snapshot_id": "snap_01KDVDNAZ83BAMMYCEGWF33DPM",
  "plan_id": "pl_01KDVDNAZ83BAMMYCEGWF33DPM",
  "parent_plan_version_id": null,
  "completion_status": "succeeded",
  "solution_status": "optimal",
  "evaluator_version": "eval-1.0.0",
  "contract_version": "1.0.0",
  "files": [
    {
      "name": "plan-content.json",
      "checksum": "sha256:a1eb0afabfbba3ff3db159497c3ff95028044dffbeead1075cd43e4a9043a890",
      "size_bytes": 512,
      "content_type": "application/json"
    },
    {
      "name": "metrics/summary.json",
      "checksum": "sha256:03ecd7ccd61ddffe9481c627ab90c65a1f7171ccbcd3109d1e44116de39a92c2",
      "size_bytes": 256,
      "content_type": "application/json"
    }
  ],
  "domain": "finance",
  "domain_schema_version": "1.0",
  "payload": {
    "plan_content": {
      "base_currency": "USD",
      "allocation": {
        "weights": [
          {
            "instrument_id": "SPY",
            "weight": 0.6
          }
        ],
        "cash_weight": 0.4
      },
      "constraints": {
        "long_only": true,
        "max_weight": 0.8
      },
      "fees": {
        "transaction_cost_bps": 5
      }
    },
    "metrics": {
      "expected_return": 0.05
    }
  },
  "written_at": "2026-01-10T09:31:00Z",
  "synthetic": true
}
